{
  "$schema": "./variables.schema.json",
  "title": "mzStack spectra variable registry",
  "description": "The canonical spectra variables, the storage columns they are produced from, their types, units and index bases, and the MassQL frame columns derived from them (mzStack-0 section 6, mzStack-1 section 5.1, mzStack-2 section 5). SQL expressions are over storage column names; each variable's storage candidates are tried in order and the first whose columns are all present wins.",
  "version": "0.1.0",
  "variables": [
    {
      "name": "msLevel",
      "type": "int32",
      "nullable": true,
      "unit": null,
      "index_base": null,
      "spectra_core": true,
      "source": "storage",
      "storage": [
        {
          "columns": [
            "ms_level"
          ],
          "sql": "CAST(\"ms_level\" AS INTEGER)"
        }
      ],
      "description": "MS level of the spectrum."
    },
    {
      "name": "rtime",
      "type": "float64",
      "nullable": true,
      "unit": {
        "accession": "UO:0000010",
        "label": "second"
      },
      "index_base": null,
      "spectra_core": true,
      "source": "storage",
      "storage": [
        {
          "columns": [
            "time"
          ],
          "sql": "\"time\" * 60.0"
        }
      ],
      "storage_unit": {
        "accession": "UO:0000031",
        "label": "minute"
      },
      "description": "Retention time. Stored in minutes, exposed in seconds."
    },
    {
      "name": "polarity",
      "type": "int32",
      "nullable": true,
      "unit": null,
      "index_base": null,
      "spectra_core": true,
      "source": "storage",
      "storage": [
        {
          "columns": [
            "scan_polarity"
          ],
          "sql": "CASE \"scan_polarity\" WHEN 1 THEN 1 WHEN -1 THEN 0 END"
        }
      ],
      "description": "1 positive, 0 negative, null unknown. Stored as +1/-1."
    },
    {
      "name": "centroided",
      "type": "bool",
      "nullable": true,
      "unit": null,
      "index_base": null,
      "spectra_core": true,
      "source": "storage",
      "storage": [
        {
          "columns": [
            "spectrum_representation"
          ],
          "sql": "CASE \"spectrum_representation\" WHEN 'MS:1000127' THEN TRUE WHEN 'MS:1000128' THEN FALSE END"
        }
      ],
      "description": "True for centroid, false for profile. Stored as the CURIE MS:1000127 or MS:1000128."
    },
    {
      "name": "smoothed",
      "type": "bool",
      "nullable": true,
      "unit": null,
      "index_base": null,
      "spectra_core": true,
      "source": "none",
      "description": "No storage source; always a typed null."
    },
    {
      "name": "spectrumId",
      "type": "string",
      "nullable": true,
      "unit": null,
      "index_base": null,
      "spectra_core": true,
      "source": "storage",
      "storage": [
        {
          "columns": [
            "id"
          ],
          "sql": "CAST(\"id\" AS VARCHAR)"
        }
      ],
      "description": "The source format's nativeID."
    },
    {
      "name": "acquisitionNum",
      "type": "int32",
      "nullable": true,
      "unit": null,
      "index_base": null,
      "spectra_core": true,
      "source": "storage",
      "storage": [
        {
          "columns": [
            "scan_number"
          ],
          "sql": "CAST(\"scan_number\" AS INTEGER)"
        }
      ],
      "description": "The instrument's scan number, as the instrument assigned it; it has no base."
    },
    {
      "name": "scanIndex",
      "type": "int32",
      "nullable": true,
      "unit": null,
      "index_base": 0,
      "spectra_core": true,
      "source": "storage",
      "storage": [
        {
          "columns": [
            "scan_index"
          ],
          "sql": "CAST(\"scan_index\" AS INTEGER)"
        },
        {
          "columns": [
            "spectrum_index"
          ],
          "sql": "CAST(\"spectrum_index\" AS INTEGER)"
        }
      ],
      "description": "Position of the spectrum within its source file."
    },
    {
      "name": "dataOrigin",
      "type": "string",
      "nullable": true,
      "unit": null,
      "index_base": null,
      "spectra_core": true,
      "source": "storage",
      "storage": [
        {
          "columns": [
            "data_origin"
          ],
          "sql": "\"data_origin\""
        }
      ],
      "description": "The source file the spectrum came from."
    },
    {
      "name": "dataStorage",
      "type": "string",
      "nullable": true,
      "unit": null,
      "index_base": null,
      "spectra_core": true,
      "source": "implementation",
      "description": "The dataset holding the spectrum, supplied by the implementation."
    },
    {
      "name": "precScanNum",
      "type": "int32",
      "nullable": true,
      "unit": null,
      "index_base": 0,
      "spectra_core": true,
      "source": "storage",
      "storage": [
        {
          "columns": [
            "precursor_index"
          ],
          "sql": "CAST(\"precursor_index\" AS INTEGER)"
        }
      ],
      "description": "The precursor spectrum's position in its run, as mzPeak stores it."
    },
    {
      "name": "precursorMz",
      "type": "float64",
      "nullable": true,
      "unit": {
        "accession": "MS:1000040",
        "label": "m/z"
      },
      "index_base": null,
      "spectra_core": true,
      "source": "storage",
      "storage": [
        {
          "columns": [
            "selected_ion_mz"
          ],
          "sql": "\"selected_ion_mz\""
        }
      ],
      "description": "m/z of the first selected ion."
    },
    {
      "name": "precursorCharge",
      "type": "int32",
      "nullable": true,
      "unit": null,
      "index_base": null,
      "spectra_core": true,
      "source": "storage",
      "storage": [
        {
          "columns": [
            "charge_state"
          ],
          "sql": "CAST(\"charge_state\" AS INTEGER)"
        }
      ],
      "description": "Charge of the first selected ion."
    },
    {
      "name": "precursorIntensity",
      "type": "float64",
      "nullable": true,
      "unit": {
        "accession": "MS:1000131",
        "label": "number of detector counts"
      },
      "index_base": null,
      "spectra_core": true,
      "source": "storage",
      "storage": [
        {
          "columns": [
            "peak_intensity"
          ],
          "sql": "\"peak_intensity\""
        }
      ],
      "description": "Intensity of the first selected ion."
    },
    {
      "name": "collisionEnergy",
      "type": "float64",
      "nullable": true,
      "unit": {
        "accession": "UO:0000266",
        "label": "electronvolt"
      },
      "index_base": null,
      "spectra_core": true,
      "source": "storage",
      "storage": [
        {
          "columns": [
            "collision_energy"
          ],
          "sql": "\"collision_energy\""
        }
      ],
      "description": "Collision energy."
    },
    {
      "name": "isolationWindowTargetMz",
      "type": "float64",
      "nullable": true,
      "unit": {
        "accession": "MS:1000040",
        "label": "m/z"
      },
      "index_base": null,
      "spectra_core": true,
      "source": "storage",
      "storage": [
        {
          "columns": [
            "isolation_window_target"
          ],
          "sql": "\"isolation_window_target\""
        }
      ],
      "description": "Isolation window target."
    },
    {
      "name": "isolationWindowLowerMz",
      "type": "float64",
      "nullable": true,
      "unit": {
        "accession": "MS:1000040",
        "label": "m/z"
      },
      "index_base": null,
      "spectra_core": true,
      "source": "storage",
      "storage": [
        {
          "columns": [
            "isolation_window_target",
            "isolation_window_lower_offset"
          ],
          "sql": "\"isolation_window_target\" - \"isolation_window_lower_offset\""
        }
      ],
      "description": "Absolute lower bound of the isolation window. Stored as an offset below the target."
    },
    {
      "name": "isolationWindowUpperMz",
      "type": "float64",
      "nullable": true,
      "unit": {
        "accession": "MS:1000040",
        "label": "m/z"
      },
      "index_base": null,
      "spectra_core": true,
      "source": "storage",
      "storage": [
        {
          "columns": [
            "isolation_window_target",
            "isolation_window_upper_offset"
          ],
          "sql": "\"isolation_window_target\" + \"isolation_window_upper_offset\""
        }
      ],
      "description": "Absolute upper bound of the isolation window. Stored as an offset above the target."
    },
    {
      "name": "totIonCurrent",
      "type": "float64",
      "nullable": true,
      "unit": {
        "accession": "MS:1000131",
        "label": "number of detector counts"
      },
      "index_base": null,
      "spectra_core": true,
      "source": "storage",
      "storage": [
        {
          "columns": [
            "total_ion_current"
          ],
          "sql": "\"total_ion_current\""
        }
      ],
      "description": "Total ion current, as the instrument reported it."
    },
    {
      "name": "basePeakMz",
      "type": "float64",
      "nullable": true,
      "unit": {
        "accession": "MS:1000040",
        "label": "m/z"
      },
      "index_base": null,
      "spectra_core": true,
      "source": "storage",
      "storage": [
        {
          "columns": [
            "base_peak_mz"
          ],
          "sql": "\"base_peak_mz\""
        }
      ],
      "description": "m/z of the base peak."
    },
    {
      "name": "basePeakIntensity",
      "type": "float64",
      "nullable": true,
      "unit": {
        "accession": "MS:1000131",
        "label": "number of detector counts"
      },
      "index_base": null,